TITLE,TEXT,REPLIES,SCORE,FLAIR,URL
Leaving behind toxic positivity and toxic productivity - WWDB,"After lurking, I decided to post. I'm a little nervous because my story is unique and may be easily decipherable, but I don't know where else to talk about this. It's strange how something impacted me in a great way, but also in a terrible way at the same time. This is going to be LONG, but it will probably be an interesting read for you.

TRIGGER WARNING: Suicide and self-harm

A little background: I have severe ADHD and PMDD (and a touch of OCD) that has been untreated for a long time and my MLM experience contributed to this. 

I will be talking about Amway and World Wide Dream Builders 

Was around the business from 18 and left when I was 21, which was half a year ago. I ended high school depressed because I was in and out of psychiatric hospitalization until I finally got to a calm point where I decided to apply to schools half a year after graduating HS and start pursuing my creative interests. 

I met somebody who talked about people who didn't go to college and were wildly successful, so that really caught my attention because I was very very bad at school and anxious because of the pressure to go. So I went through a process and earned mentorship. It was fun at first - I was excited because I felt like my life now had meaning and I had people believing I could be successful, which was one of the good things that came out of the whole experience. Although it didn't help in the long run, it did help me with my mental health in the beginning. Reading self-help books and listening to positivity gave me a mission to follow, which I desperately needed at that time. 

I decided to not go to school and started working full-time to make money for business building and becoming personally responsible. I went through a lot of personal growth getting out of my shyness and gaining self-confidence. 

Now, this has been three years of involvement, so the majority of it was a blur. 

A year into working at a 9-5 job, I became increasingly suicidal and depressed, which unfortunately wasn't abnormal. The thing about PMDD and depression for me was that sometimes I can handle the waves and then there are occasional times where I absolutely can't handle it. I was stressed because somebody I thought I loved left (I have severe attachment issues), and the pressure of 'building the business' which included reading, listening to a positive podcast, sending a message to upline, and finding people who are interested in meeting my mentors. It became unbearable, and I was afraid of talking about it to anyone because I wanted to be a stable person who can become successful. 

One day, something inside me burst and I found myself sitting in my car with a big bottle of pills, crying my eyes out. Note- I've never attempted suicide. I didn't come close to swallowing all of those pills, which will tie into the rest of the story. 

I called my manager, then I called my dad saying I wanted to kill myself right now. Then my dad picked me up from 30 minutes away. I was a mess. 

That night, I went to go out to my church small group who were a very supportive and loving group of friends and talked about what happened. I felt a little better, especially since I didn't want to be alone. I texted my upline something like this:

""I wanted to tell you that today I felt a huge urge to take my life and left work early. I'm trying to get a grip of reality right now, but I may be spotty in responding"" (since we were meant to communicate every day. 

Mind you, work was very important in the WWDB world because it was the way to build personal responsibility and have money to build your business and have a high point volume each month. I always felt really really guilty about not following through with going to work because I didn't want to be seen as lazy or incompetent. 

I can't remember what they said after my text, but over the next few days, I was off from work, sticking to my dad the whole day because, in my safety plan, I always have to be with someone for a while after a breakdown. 

Upline would text things like ""How are you? What are you doing today?"" and I'd tell them I was with dad and going along with him to grocery store"" (for me, I try to do normal daily things to distract me from how I'm feeling)

Then they ask me something like, ""Is it possible that this is a way of getting attention from your dad?"" At that time, that really didn't sound terrible, but I was always doubtful of myself. I know they said this because earlier in our friendship we talked about our dad issues and how they affect us today. I told them that I didn't think so. 

Following that, I had the choice of extending my leave of absence, which I did. Upline texted me, ""when do you go back to work?"" and I said I asked for an extension of a few more days (since it was the end of the week at that time). Then came the reply, ""is that going to help you towards your goals?"" I felt embarrassed and texted back ""no,"" and they said ""you can probably call them and reverse the extension."" I didn't, I kept my extension and pretended that I went back to work the next week. 

I ended up finding another job that was easier and closer to my home, and paid more. I took that job after talking to my upline. I still was depressed and had bad PMDD bouts where I would shut myself in the bathroom and cry for half an hour. But, I needed to make money and I needed to be personally responsible. 

I was still attending board plans and conferences and such. They actually helped me a bit because everyone was positive and encouraging. 

I spent a lot of my free time talking to people about the business and honestly, I was just as burnt out as before my suicidal incident. But I kept going because this was going to be part of my success journey. 

I had a ""mini"" breakdown and asked my upline if I could sit down and talk with them. They said once in a while is fine when it's not involving the business and wanted to make sure I wouldn't ask to sit with them frequently. 

I told them why I thought I was depressed (now I know it was also chemically and hormonally motivated) - sexual assault when I was younger, bad relationships, etc. They responded with how in their neighborhood growing up, there was a lot worse sexual abuse going on, and people do overcome it if they continue to grow. I wasn't sure if I was encouraged, but I believed that I could just get over the ""junk"" in my life. 

It's always encouraged to reach upline for help with anything - emotionally, physically, business-wise, financially. Nearly every time I had urges to self-harm or suicidal ideation, I would send a voice message upline, crying. I said things like, ""I feel like I really want to cut myself, etc. I don't know how to get through this."" The responses from them would be ""don't listen to your emotions and feelings, focus on your goals, this negativity probably means you're not getting enough positive input."" I didn't think that was unreasonable at the time.

One time I was talking with them on another occasion about suicidality and depression, they said that they knew people who actually killed themselves and what that looks like. I also got, ""I don't think you're suicidal, I think you're just not following through with your goals,"" and ""If you're suicidal, why haven't you killed yourself yet?"" - and then peppering in how everybody has suicidal thoughts pass their mind, and they're just thoughts. 

Now I believe that they're not just thoughts. They're dangerous desires I felt compulsed to fantasize about. 

This upline has had their own experience with depression and anxiety and has chalked it up to not having a life purpose or positive influence in life. They said that in building the business and mentoring people, they overcame those issues and are now free from them. They were also vocal about how psychiatric medications are a farce and don't do anything good. 

Another head-heaving aspect of all this was regarding my new partner. There's this mentality in WWDB that you are allowed to do whatever you want, but the wrong decisions will not bring you to success. So, my conscience would constantly be on overdrive and feel so guilty when I wasn't doing the right things according to the leaders. Note, they never told people what to do, but encouraged them to believe that some things will not help you grow and be serious about building. 

I met this amazing, goofy person at my work and started dating. I didn't tell upline until I felt guilty about it and ""confessed"" later. Why did I feel guilty? There's this belief within the community that you will have the best life if you have a partner that is ambitious and is on the same page with the business. This person I was dating had different goals than mine, but I brushed that aside because of how much of a compassionate person they were. 

As I thought, I was asked if what I wanted in life was someone who may not be as ambitious as I was and how it might cause heartbreak in the future. I truly truly believe that upline was saying this with a tender heart, but it caused a lot of confusion for me. 

Everytime they asked about my partner and when I'm going to have the conversation to see if he would appreciate meeting my upline, it would hurl me in an anxious spiral. Why couldn't I just let my partner be themselves and just continue with what I was doing? It wasn't like upline was saying I can't be with this person, just asking questions that made me think about it like, ""this relationship may slow you down from your big goals."" 

Now, I hadn't pursued therapy or psychiatric help during all of this time because I hung on to how I should be able to overcome my mental health issues by following through and focusing on the business. I wanted to be a good example, and follow what upline did, which included ditching a therapist after earning partnership with successful entrepreneurs. 

I wasn't explicitly discouraged from going to therapy or seeking help, but there were comments of how negativity in life means you're not following through with building the business or are not close enough to upline. 

I also forgot to mention, I was considering going to a therapy residential or inpatient program because of my terrible ups and downs with my depression. I felt so guilty about even considering it because it meant taking a break from building the business and it would show I just wasn't committed enough. 

It finally got to me when every time upline texted me, it was anxiety-inducing. It was hard to have a normal text conversation most of the time because there was always some kind of checking up on me. In WWDB, (and I understand where they come from with this because I agree to some extent that if you want to be wildly successful, you have to sacrifice a lot of comforts), you're discouraged from social media, downtime, reading non personal growth books ( I loved to read fiction but gave that up for a while because I couldn't read them without guilt), casually hanging out with friends, wasting time, drink, party, go on vacations, spending too much time with non-ambitious people, watching TV, listening to music. 

Texts would sometimes be like ""what are you up to?"" and I'd lie and be like ""oh, I'm out talking to people"" When I was really in bed scrolling on reddit or something. Or, I would text them a video of kids I was babysitting saying hi - and the second time I did it, upline would ask ""is this the only job you're doing right now?"" Just felt like I couldn't be myself but also I wasn't confident enough to speak how I really felt, which is why I feel like it went on for so long. 

I finally decided to get psychiatric medication and oh my gosh... I hadn't felt that clear in like, ever. It was amazing. It was my answer. I was able to get a better look at my situation and realized I decided to build the business because I was depressed and life had no meaning, and it felt like the only thing that gave my life purpose. But, my medication made me feel that I had a purpose and I had no reason to do things that sapped me. I decided I wanted to pursue my lifelong dream of journalism and beyond. 

I left abruptly. I get nervous whenever I get a text from them and feel a little bad because I basically ghosted. I just can't talk to them without them trying to get me to see that my situation is fixable through the business and such. I just can't.

I also knew they would discourage me from moving in with my boyfriend, because of ""influence"" and other stuff. 

I'm happy I left.

**TLDR** Hard to sum up- but basically was engulfed in toxic positivity and toxic productivity that I neglected my mental health which could've ended up badly.",12,50,Amway,https://www.reddit.com/r/antiMLM/comments/qgqk8d/leaving_behind_toxic_positivity_and_toxic/
"Storytime: A short conversation with a young USANA Hun (and ended up rejecting her ""invitation"")","Hello, wherever you are!

You may noticed me commenting on every other posts in this subreddit, and I've decided to share my own story about my experience with an MLM. As they say in Spanish, *sin más dilación*:

More than half a decade ago (either five or six years earlier), I was on my way home from applying for a job in a call center in the Philippine city of Lipa (the company in question, by the way, is TeleTech, whose global corporate headquarters is in Colorado, near the MLM epicenter), riding through a *jeepney* (a common form of public transportation here) when I blurted out on my relatively problematic blood pressure, as I was totally sedentary at that time, because such problem runs in both sides of my family as I took a tablet of maintenance medicine and drank a bottle of water.

Suddenly, a female student younger than me noticed on my then health condition and initiated a conversation with me. She was quite nice, I noticed,  and I quickly learned that she was studying at the same college that I've attended years before, and that was before the full implementation of K to 12 (also known as the appearance of Senior High School) in the country. 

After the short introductory chat with her, the student revealed to me that she's actually a brand representative of USANA, explaining that one of her company's supplements could actually combat hypertension, which was quite too good to be true, I now realized. As our conversation progressed further, she nicely explained (or should I say boasted?) that the headquarters of USANA Philippines in Makati had occupied a single floor of one of those skyscrapers there, and revealed that the local branch of USANA is located in the building just in front of the college that I've attended for four years. In the end, she asked to write my mobile number as she invited me to attend of their ""meetings"" the following day, which I thought it was quite sudden, but I ended up giving her my digits, because I thought it was rude to refuse her upfront.

The following day, I just received her text message, checking me if I'd go to her ""meeting"". I never replied, because the distance between Lipa and my hometown is greater and public transportation costs could significantly eat up my pocket money. Just a waste of time and money, in short.

 Looking from today's perspective, I realized that the decision of not attending an USANA ""meeting"" was correct, because I don't really imagine myself losing my soul (as well my own money and time), as I always commented in every other posts here.

I hope you enjoyed reading my story, despite my level of English (😅) and the period that lapsed. 

Take care, wherever you are!

**TL;DR**: Had a conversation with a young female student on my way home from a job hunt; she turned up to be an USANA Hun, inviting me to attend their ""meeting"". Neither replied nor shown up on that fateful day.",4,14,USANA,https://www.reddit.com/r/antiMLM/comments/qgoaly/storytime_a_short_conversation_with_a_young_usana/
Pressured to join Rodan & Fields,"
I was one of those kids who almost got suckered into the Vector Marketing scam when I graduated high school in the US. 

More recently, somebody in my family back in the US has pressured me to join Rodan & Fields since they expanded to Japan.

Even worse, they were pressuring me in to join mid-pandemic when I already experienced job loss and was the social distancing queen. I hardly know or talk to anybody. I know I’d have to shell out a few hundred dollars for my “starter kit”.  It would also complicate my income tax situation. 

Also, I live in the country where skincare is essential. People in other countries pay top dollar for shit I can buy at the drugstore. I also don’t make much money and buy all my stuff at the drugstore. My family’s excuse was “the line of products will be unique and specially formulated for the Japanese market”. Yeah, right. 🙄

Part of the reason Chinese tourists buy drugstore products in masses when visiting Japan. They sell it for more money upon returning home and people are willing to pay.

Edit: Obviously I said no. But R+F is expanding to other countries and targeting people on LinkedIn and the like. Beware.",6,20,Story,https://www.reddit.com/r/antiMLM/comments/qgh8j9/pressured_to_join_rodan_fields/
The blatant lying of this Hun… I feel bad for the struggling people she actually sucked in,"https://imgur.com/a/RdrbkLm/ 

I’ve been friends with this Hun on Facebook for years. Don’t know her super personally but know her from around town, kids activities, etc..

So in this post she says a year ago they were “dealing with getting our phones shut off, or deciding whether to pay the utilities or get groceries” as well as some sob story about her daughter having to ask the grandparents for dog food.

Let me tell you, there is no way they were at this point a year ago. 2 years ago they built a brand new humongous house in a nice neighborhood. They drive nice cars, wear nice clothes, and go on multiple nice vacations a year (Disney World, Sandals resort, cruise). Also, they frequently eat out at nice restaurants, we’ve been members of the same over priced gym for a few years. Her daughter is on expensive competitive/travel sports teams and gets multiple private lessons a week. And when the team does travel, the whole family goes for the weekend too!) If they were TRULY in that position a year ago, well that was definitely from their own incredibly crazy priorities of where their money goes….


It just makes me really sad (and makes her seem really really low) that she would post this. I know she’s high ranked on whatever the heck she sells, so that makes it even worse that it means she’s suckered in so many people below her 😡😡😡😡",10,31,Rant,https://www.reddit.com/r/antiMLM/comments/qgehc1/the_blatant_lying_of_this_hun_i_feel_bad_for_the/
Inventory loading anyone? Color Street Hun trying to sell her 500+ sets,,15,59,Story,https://i.redd.it/78t6pum3bpv71.jpg
They say success is the best revenge,"I was in an MLM a few years ago. I got manipulated, made to feel less because I couldn’t make a sale, and was broken into a million pieces. Last week, I wondered what has been going on with my team leader from the MLM I was in, so I looked her up on Facebook. I come to find out that she’s still in the MLM, which didn’t surprise me one bit. 

2 years later I’m now graduated with my B.S. in cybersecurity and I’m an engineer at a cybersecurity firm. I also will be starting my masters in digital forensics. To anyone looking to get out of an MLM, please know that you CAN get out. You can shuffle the cards you were given for a better deck. Life gets so much better after leaving. 

I finally feel free and empowered!",35,348,Story,https://www.reddit.com/r/antiMLM/comments/qfqpah/they_say_success_is_the_best_revenge/
MLMs are like Costco,"A hun on FB was asked “why would I have to pay for a membership for my ‘own company’?” 

Hun: “great question! It’s just like Costco! Where you pay your yearly membership and then you get to shop!”

Other person: “but Costco is not my own company so that doesn’t make sense?” 

Hun: “but it’s your own groceries!!” 


..what",78,796,Story,https://www.reddit.com/r/antiMLM/comments/qfnruf/mlms_are_like_costco/
Blind obedience to Amway,"So my bf joined amway without me knowing (it's a long story) Anyways I haven't left him yet, but he listens to these shitty audios all the time? And they're AWFUL. They always talk about not spreading negativity, but then they turn around and the next words out of their mouth are saying to cut friends and family off if they don't ""support your buisness and have a growth mindset"". 

Speaking of mindset, that's a word that comes up often. Having a growth mindset to them, seems to mean being willing to do anything and everything for this ""opportunity"". That means cutting family and friends off, spending your own money to get PV (the way sales are measured), doing whatever your upline says with no questions asked (one of their ""3 powers"" is submitting to authority) and missing major life events for the sake of their ""own business"".

That's not a mindset. That's blind obedience, which is what amway really wants. I see a lot of people on this reddit thread saying that amway will take anyone and everyone into this business given a chance. Thats not entirely true, there is a ""vetting process"", which is where a ""candidate"" sits with a mentor and is told to read some self help book and then asked deeply personal questions about how far they're willing to go and what their motivation in life is. They are then judged to see whether or not they listen. Its not whether they are good at sales or whether theure qualified. It's a test of obedience. Will they read the stupidly long book? Will they dress in uncomfortable buisness clothes after work hours? Will they take criticism on their life choices? 

That's what amway is about. Not sales or buisness. It's just people blindly obeying unqualified idiots in hopes of being ""financially free"". In essence, it's absolutely bullshit. Never ever get involved with these people. If you get the chance, run.",45,130,Rant,https://www.reddit.com/r/antiMLM/comments/qfn7ev/blind_obedience_to_amway/
Finally watching the LuLaRoe documentary and wow yikes on bikes…,"Just started this and so far all I have to say is

1. THEIR KIDS MARRIED EACH OTHER??

and

2. What were those men doing having little girl’s dresses to sell in the 90s??
(read: likely highly religious men due to the social circles the founder kept, and in the 90s before gender roles started to flex as much as they are currently. something seems off about this part of the story and it’s bothersome).


I’m so skeeved out and I’m only halfway through episode 1.",38,116,LuLaRoe,https://www.reddit.com/r/antiMLM/comments/qf6k0b/finally_watching_the_lularoe_documentary_and_wow/
I outhunned a hun at Starbucks,"Someone’s post about being targeted at a Target reminded me of the time I was approached by a hun at a Starbucks. I was working on a design project, and she approached me with what I’ve since learned is termed “warm chatter.” She starts off seeming to legitimately want to be friends, and we run into each other a couple more times at the same coffee shop. Then she moves to asking what I’m working on and if I like my job. She asks “what do you work for? Schedule flexibility, financial opportunity, or travel?” I tell her all three. Of course, she tells me about a job opportunity selling Mary Kay. 

Me: thank you, but I already have a job I love. Check out my website! What’s your website?

Her: marykay.com/[hername]

Me: why isn’t it just “your name” dot com?

Her: we’re not allowed 

Me: how do people decided to buy from you instead of someone else, if you can’t independently brand yourself

Her: *gives spiel on the power of relationships*

Me: oh, I don’t like people. That’s why I really like my job.

Her: how would you like more flexibility?

Me: I’m at a Starbucks instead of an office in the middle of a workday, so I don’t think I need it?

She then starts to tell me how successful she is and how much she loves her life, so I go: “I love that for you. Actually, the students from this project I’m working on could use some sponsors, and they have tiers as low as $100. It’d be a great show of support from a local small business owner.”

She then goes “um, I think I’d like to do more than give $100.”

Me: Great! Here’s my number—I’ll put you in touch with the program director, and I’m sure she’ll appreciate your enthusiastic support.

Would you believe she never answered my followup texts or tried to talk to me again? I actually out-hunned a hun without even trying.",131,4974,Story,https://www.reddit.com/r/antiMLM/comments/qf4kgw/i_outhunned_a_hun_at_starbucks/
