TITLE,TEXT,REPLIES,SCORE,FLAIR,URL
I literally tried to buy the shampoo and a hun wouldn’t let me.,"Last night I attended a good friend’s wedding reception. Knowing there would be a few huns in the crowd, I thought about what to say in the inevitable confrontation. I didn’t want draw attention to our conversation and knew I’d have to bite my tongue. Here’s how it went after a couple minutes of small talk and catching up. 

M Hun: You know you could really increase your income selling MONAT.

Me: Yeah with a family and full-time job, free time is kinda scarce. 

M Hun: But it can TOTALLY be a side hustle.

Me: Thanks, but I enjoy and find my job very fulfilling and want to solely focus on my current career. But I’d love to try your products *LIES*, where can I buy the shampoo?

M Hun: *SIGHS* Well, I guess you could be a customer.

Me: Yeah, can I buy some?

M Hun: Why don’t you just give it a try?

Me: You mean shampoo or selling?

M Hun: Selling!

Me: Oh, I’m not Christian either.

M Hun: *GOES SILENT AND CHANGES SUBJECT*

So the moral of the story, if you need an escape, just say you actually want shampoo and don’t believe.",57,747,Monat,https://www.reddit.com/r/antiMLM/comments/qexngl/i_literally_tried_to_buy_the_shampoo_and_a_hun/
Anyone else catch this in the story about negligent 911 dispatchers?,,9,7,MLM literally killing people,https://imgur.com/5fkFfeU
"Almost got roped in a while back, but now I can't remember the name of the mlm!!! Help me identify it.","Okay, so this woman I knew from college was a Title Boxing and Orange Theory instructor. When the pandemic shutdown was happening, the gyms closed. So obviously next I got a message about an ""exciting new opportunity"" she was taking advantage of. The only time I talked to her was in passing at Title Boxing. Anyways, all I had to do was sign up to watch her live stream to learn more. So I did. 

Long story short, the company wanted you to do 2 things:

1. Sign people up for ""essential technology services through THEIR representative"" and the representative will get a cut of your monthly bill.

2. Sign other people up to be reps. 

There was no physical product. The rep just gets a percentage of the bill you pay every month. 

Help me remember what this was!!!!",4,9,help me remember,https://www.reddit.com/r/antiMLM/comments/qejnm4/almost_got_roped_in_a_while_back_but_now_i_cant/
Kyani,"I have story I need to share. 

It’s long difficult overwhelming and sad. 

I do not know how to begin or where, I struggle with putting words together.

This story involves an MLM that isn’t commonly heard of. Kyäni. They aren’t like your typical mlm because they are not allowed to post on social media. They are supposed to only grow through friends family and recommendations. 

This story involves money, of course, loss of friendships and distancing from family members just like your typical MLM but it gets deaper and more painful because it also involves death.
The unnecessary death of a loved one that we still have not gotten over. At the end of it all our family lost lots of money, a loved one and friendships.

Kyäni is the only reason I am on this Reddit and on this Sub. A google search somehow lead me here about a year ago. 

I am trying to find the words and coherence to put it all together for y’all but I am really struggling here. 

Right now all I can say is Kyäni is the devil and please stay away from any and all MLMs. 

I will he back soon with the full story.

Thanks for reading.",23,63,Story,https://www.reddit.com/r/antiMLM/comments/qejmwj/kyani/
drama! Read the captions,,47,1900,Story,https://www.reddit.com/gallery/qeiqvm
"I unknowingly got targeted by an mlm hun .. I had NO idea they are on the prowl in real life acting like they want to be ""friends"" . I met up with her for coffee and was shocked and cornered ...","I met this really seemingly bright woman at target looking at makeup products. We started talking and got along well so I said we should grab coffee sometime ! We exchanged info and she text me a few weeks later. 

Well I went to meet her today and we are talking about things/life and it's all pretty normal. 

Then she starts talking about ""financial freedom"", her mentors who are 40 and retired and millionares, what she sells and does... i was like...so an mlm?? And she's excitedly says yes! I felt the dread hit me like a tons bricks. She could see my demeanor change. So she starts explaining how there's two different types and she is this better type... not the leggings/makeup selling kind. That her stuff is quality and she sells all kinds of items . She then goes on to say her company doesn't allow any of their people post on social media or sell via social media and they can only do it through word of mouth networking. I then realize what this is . 

I am a target she met in target. I don't know If she planned it but I have to give her that at least. 

She wants to sell me stuff. She shows me things and her ""website"". Ugh. I can't believe this . I am nice but also feel cornered. Feel kind of like wtf people are doing this? This woman and I spent like an hour talking before this bomb.  I won't buy anything so is this worth all her time and effort ? Is this really leading her to the financial freedom she thinks it will? Man I just have a bad taste in my mouth after all that.",171,1042,Story,https://www.reddit.com/r/antiMLM/comments/qeemkd/i_unknowingly_got_targeted_by_an_mlm_hun_i_had_no/
That time I got my friend out of a cult (MLM),"A couple years ago, I saw a post on my friend’s private page that made me stop and actually consider buying from an MLM. She claimed that taking certain Plexus helped her depression, and I was really intrigued. I asked her about it and she recommended a few products, while quoting me around $80. Steep for supplements but in the middle of TTC, and really depressed, I really wanted something that would take the edge off without going on prescription meds. Yes I know, I was dumb, but I was also desperate, which is how they convince you that you need it and it will fix you. 

Later on, probably two weeks in, I was charged around $150. . And vowed never to use her again even though I liked how I felt while taking these supplements. Until I looked up each product and realized I could buy the same thing on Amazon, for less moola and better quality. I said i’d finish up what I had bought from her and then start using what I had found. 

Two weeks later, I received an email thanking me for becoming an ambassador and to approve my next order. WHAT? I called and apparently this woman had not only signed me up to sell this mess without my permission, but had used a fake SSN to do it. I was furious. I canceled it all and messaged her, asking why she would go that route instead of making a sale. 

Guys, these companies tell their bottom line to sign people up for free, without their knowledge, and make up an SSN/use their own SSN if possible to “create their own bottom line.” When I explained to her that no, that’s not okay, and no, I would not be selling this mess for her, she got quiet. She stopped posting about it on her page and later admitted she thought the practice was sketchy but she was reassured that that’s how it worked. 

It’s 2021. I was approached to buy color street a few weeks ago. I said he’ll no and that she needed to get out. How are people still falling for this?",10,64,Story,https://www.reddit.com/r/antiMLM/comments/qe69kx/that_time_i_got_my_friend_out_of_a_cult_mlm/
