TITLE,TEXT,REPLIES,SCORE,FLAIR,URL
I come to you as a former hun,"Apologies in advance, this is gonna be a long post, but I feel like I need to share. Tldr at the end. 

Last year I (f26) was roped into joining an mlm. 

I actually run my own business with my SO (we do gemstone manufacturing), and last year when rona hit, like most other businesses, we were hit hard. In our country, we could reopen our business at level 4, but our jewellers could only open at level 3, so we spent about 3 months with no income, and then a further 2 months of little income because, understandably, people were prioritising buying food over jewellery.

A ""friend"" of mine reached out during our first lockdown and asked me if I was interested in getting a second income. Honestly, I was so stressed about my SO and I not being able to pay bills (I was still paying off a student loan at the time) so I thought why not!

Now, at the time, I had never heard of this company. She set up a Zoom meeting with her ""partner"" in the business and they explained how amazing it is and that they were able to make money from home and help so many people with the products they sell.

Now, I like to think that I'm a relatively smart person (obviously not THAT smart apparently), and the way they explained the business ""position"" was that I would basically be a sales person, so I jumped at the opportunity because sales is my forte!

It started with the toothpaste (I'm sure you know which company I'm referring to now), then the other products. When I didn't make a lot of sales from the toothpaste, I had a Zoom meeting set up with my upline's upline's upline, and she started telling me to buy the products as a way of ""encouraging"" myself to make more sales. After all, if I buy the products, I have to sell them! I started asking friends and family for help, asking them to ask their colleagues to buy from me. They were all very encouraging but no one wanted to buy. I felt like a failure, not just to myself, but to my SO because I couldn't provide for us.

Then I was encouraged to use any earnings I made to purchase the most expensive product (the lumi) in order to ""prove"" to potential customers how amazing it was. Only then (yeah I know) did I start to realise what was happening. I tried convincing myself it wasn't what I was starting to think it was. When our actual business finally started making decent income again, I told myself I'd just sell the products on the side. Then it started taking over my Sundays where I had to attend virtual seminars, then every Monday and Wednesday morning, until eventually I couldn't even do the work I needed to for my own business.

So I stopped selling the products. I was honest and told them I just couldn't do both jobs. They said anything and everything they could to get me to stay, but I stood my ground.

Looking back now, woooooow, I cannot believe I fell for it all. The friend that roped me in doesn't even talk to me anymore. I feel so horrible for roping in the other girls that I did and lying to them about wanting to work with them because they were so great, when now I don't even talk to them either, I literally just used them like I was used.

Anyway, my business is way more successful now than it ever has been, so I have no regrets! Also, I LOVE this group because it reminds me of how naive I was only a year ago and some of these posts remind me of myself. 


Tldr: Was a hun for 2 months, now no longer a hun, and love to read the posts here because it reminds me of how stupid I once was",13,237,Story,https://www.reddit.com/r/antiMLM/comments/qq929f/i_come_to_you_as_a_former_hun/
My college roommate,"Im so glad I found this page!

A few years ago, I reconnected with a roommate from college that I hadnt seen in about 16 years.. 

A bit of back story. She was a NIGHTMARE in college. A spoiled little girl who was only living in the dorms and even attending college because mommy and daddy wouldnt keep buying her things if she didnt.  She would stay up all night crying on the phone with her boyfriend and then go crying to the RA in the morning when I would have to get up and get ready for classes because I was ""keeping her awake.""  Spent hours in the bathroom, never cleaned and used to fill MY refrigerator with her stuff. I was so glad when that year ended and I was able to transfer to a different dorm.

Years later when she found me on facebook, I figured she would have grown up.  Nope. She hadnt.

And thats when the Lularoe plugs started. I must have gotten a 100 invites a day to join in on her ""virtual parties."" Every single post was about her ""new business."" It was FAR too much. 

Or so I thought. One day, she posted a long story about how her grandfather was dying, how much she loved him, how much he inspired her and how ""Life was too short."".....

To which she followed with ""Thats why Im hosting a 'Life is Too Short to Wear Ugly Clothes Sale....""....complete with all of the hashtags.

I couldnt hold it back anymore. I posted publicly that it was disgusting and morally reprehensible to go so far as to use her own grandfathers impending DEATH as a plug to sell LEGGINGS. That she was just as selfish and clueless as she was in college and that her family ought to be ashamed. 

Out came all the ""bossbabes"" with their lashing tongues, hashtags, and ""You're just jealous of her success."" 

Last I heard, she met a guy who go her pregnant on the first date but moved with him to California and made the ""announcement"" 8 months later, claiming she didnt know she was pregnant. Her ""business"" failed within 6 weeks.",4,78,LuLaRoe,https://www.reddit.com/r/antiMLM/comments/qq350e/my_college_roommate/
Close friend of mine shares story of a painful personal tragedy in their family. MLM hun decides it is an appropriate time to slide into her messages.,,112,669,Rant,https://www.reddit.com/gallery/qph1p7
My ex wife folks making up bullshit to peddle her mlm garbage. Her husband ran into a large sum of money from the government is the real story. She's jobless and broke still.,,6,102,Story,https://imgur.com/MECSKjb
“Multilevel Marketing” Companies Cheat and Exploit Ordinary People on a Vast Scale,"Jacobin: 

""So-called multilevel marketing (MLM) schemes have been around for decades, and for almost as long as they’ve existed, they’ve carried a pungent whiff of fraud. But as author and longtime MLM expert Robert FitzPatrick argues, the industry has only grown in size and influence since its inception — remaining a poorly understood and criminally underregulated enterprise that generates billions in revenue every year while scamming countless Americans. 

As FitzPatrick notes, MLM has eluded not only the wrath of law enforcement, but also the scrutiny of investigative journalists and the critiques of progressive advocacy and activism — despite extracting billions of dollars from millions of people each year and well-established ties to the political right. 

Jacobin’s Luke Savage sat down with FitzPatrick for a wide-ranging conversation about the history, scale, and structure of MLMs, and why there’s no such thing as a legitimate MLM.""
#MLM
https://jacobinmag.com/2021/11/mlm-pyramid-schemes-fraud-amway-devos-lularoe",3,57,Amway,https://www.reddit.com/r/antiMLM/comments/qobhtm/multilevel_marketing_companies_cheat_and_exploit/
I Wasn't Even 18,"I've wanted to share this story for awhile now but whenever I tell it to people they don't really seem to get why it made me feel so weird and uncomfortable.

I used to work in-person retail, this took place during 2016. I worked mostly the cash register since I'm a social butterfly and good at having conversations with customers. 

An older woman comes through my line and idk what started it, maybe I was just being nice, or maybe I was genuine but I remember remarking how I liked her lipstick. Cue her pulling about fifty packets worth of lotions, perfume samples, etc and shoving them at me, explaining she was an Avon rep and they're always looking for people.

I was 17. I certainly did not look like an adult so it was already weird to kinda put the pressure on a kid. I took the stuff with a smile to be nice and rung her up and she left. Pretty sure I threw it all in the garbage after because it smelled weird lol.

I thought that was the end of my interaction. EXCEPT SOMEHOW, I started getting texts from her regarding Avon sales, and how to be a rep and ""have your own business."" 

I couldn't figure out how she got my number, so I essentially did a reverse Google search of me to see where I screwed up. The only logical way she could have done this is looked up my name (which where I worked, only had the first initial and the last name on the receipt and my last name is not unique) found me on Facebook by narrowing it down to the fact I had put on my profile where I worked, and she had to continually scroll until she found ONE POST I had made back in like 2013 where I had posted a question about a fucking middle school dance and put my phone number in there. It was one of the only posts I ever made that wasn't private because I was 14 and stupid when I made it.

She never stopped texting me. Ever. About twice a week I would get something. I never replied but she wouldn't stop, and at 17, blocking the number of a person you lived in a small town with who had seen your face seemed scary. I finally got my number changed after getting a new phone and stopped getting texts. 

But I'll never get over how weird and predatory that was. My birthday is DEFINITELY on Facebook so she had to have known I was underage. To this day even thinking of Avon makes me feel gross.

Lesson learned: make sure all your social media is private or unidentifying. Or you might get a Hun in your DMs for over three years.",5,106,Story,https://www.reddit.com/r/antiMLM/comments/qo1uxz/i_wasnt_even_18/
Bumble BFF has an MLM problem[article],,4,24,Story,https://www.inputmag.com/culture/bumble-bff-mlm-multi-level-marketing-pyramid-scheme
Not sure what to title this but thankyou,"I was working out at the gym when this guy started taking to me. He was quite friendly and we hit it off well. I give him my number (and now regrettably my email address). He was telling me about how he has a business where he helps people make 3-5k outside of their monthly income and a bunch of other stuff. He made it seem like they would like buy low priced stuff on websites and sell it for higher on other sites like amazon. I was a bit interested so I met with him today. He’s actually going to be a speaker at what seems to be an Amway LTD rally in a few moments. Then he was asking me about my life story and kept talking about how his like was “just like mine” and how it was like “looking at a younger version of myself”. I asked him what the business actually was and he said “you’ll understand once you come to the event, here i’ll just invite you now”. Quite suspicious, then he continually talks about how it’s not about the money but about doing it for “family” and “obligations” and whatnot. Honestly it all just didn’t seem right to me so thank you to this Subreddit because you gave me the information I needed to know without having to go to one of these rallies or anything like that. Truly grateful I dodged this bullet",6,44,Story,https://www.reddit.com/r/antiMLM/comments/qmxlzy/not_sure_what_to_title_this_but_thankyou/
Bumble BFF has an MLM problem,,9,58,Story,https://www.inputmag.com/culture/bumble-bff-mlm-multi-level-marketing-pyramid-scheme?utm_source=twitter&utm_medium=partnerships&utm_campaign=mic
Someone called police on me after contacting.,,9,17,Story,/r/mlmstories/comments/qmgcpe/someone_called_police_on_me_after_contacting/
"Instagram figured me out…ugh. Apparently, I’m the type of woman who might get sucked into an mlm. Every other ad is vague and like “get a new side gig, spend time with family, do it from the beach. “ I’m getting major mlm vibes from these ads, anyone know what’s up with these?",,9,38,Story,https://i.redd.it/ejls6iw5i9x71.jpg
Devil corp experience,"I found a link to information about the “Devil Corp” on this sub earlier, and now I finally know the answer to something that has been gnawing at me for the last 12 years. 

It was 2009. I was home from college for the summer and having extreme difficulty finding a seasonal job. Out of pure desperation to get out of my parents’ house and earn some money for the next semester, I responded to a shady looking Craigslist ad for “marketing reps” against my better judgement.  No company name, no actual job description, you know the drill. 

I went through the interview process and sure enough, they sucked me in with their “hip” office decor and young, outgoing staff. I accepted the job without having any idea what it actually entailed. 

For my first day they had me train with this bubbly college dropout. We met at the office and she drove me to her “territory” which was about an hour away. I was so wrapped up in chatting and getting to know her on the drive over that once again, the job duties never came up. Finally she parked the car. We got out, she opened her trunk, and showed me boxes of framed prints. “We’re going to sell these. Grab some.” 

I was totally confused but grabbed a bunch of prints and followed her into a retail store. Then to my horror, I watched her cheerfully try - and fail - to sell prints to *every single person* in the store. I could feel my face turning red with embarrassment, but she wasn’t fazed by any of it. We walked out and I followed her inside the business right next door, where the exact same thing happened. We did this for a full 8 hours. She even barged through a *nursing home.* I wanted to run but I was in an unfamiliar area and my car was not accessible so I had to stick it out. 

After 8 hours we had sold an impressive grand total of 2 prints. One to a poor schlub who worked at Subway, and one to an office receptionist (where we were kicked out of the building immediately following the sale). I believe her commission totaled $40. I didn’t get a dime and didn’t care, I just wanted to get the fuck home. 

I played it cool on the drive back. I pretended like I’d had a great day and couldn’t wait to go out on my own. This was a survival tactic so she wouldn’t drop me in the middle of the woods…or worse, because those were the types of vibes I’d been getting. But I never went back or returned any of their calls after that day. 

For 12 years now I’ve been perplexed as to what the hell this company actually WAS, and now I know.",3,44,Story,https://www.reddit.com/r/antiMLM/comments/qky223/devil_corp_experience/
I was told to post this short story here.,"Astaroth gazed around the circle. Black candles rendered from the bloated, suffocating souls of the damned encircled the enormous magical symbol. The infernal runes that blasphemed the universe itself has been carved by his own claws into the black speckled red stones.

He grinned his wickedly fanged maw in anticipation, as he would summon the most terrible fiend of the mortal realm, a being of terrible might, prophesied to bring a terrible, defiling order to the accursed pit of evil.

It was time. He led his own daughter to the circle and slit her throat. The blood poured into the circle and formed blue flames as the candles went out, and a black bonfire began to roar in the center on the circle. He spoke terrible words in a language forbidden to even his kind, curses and profanities so dark that he felt even his rotten soul cry out in terror.

When the final word was spoken, he called out the name of the most terrible of evils.

""Heed my call! Tear this accursed land asunder! I call you, Cae'rin!""

The black flames exploded outward, ripping into all who stood around the circle, and blowing all about.

Astaroth laid bleeding. His limbs were torn and broken, and he barely had the strength to look up. Is... Is that the most vile mortal fiend? No fangs. No claws. Dressed in simple clothes. And... What was that case she held?

The human approached him, and squatted down.

""Hey hun! You look like you're in need of a career change! Have I got an offer for you! How would you like to make big bucks while working from home for only a few hours a day? You can be the CEO of your own business, and our products really work! If you join now, you'll get a complementary sample product to try before you get out there and earn your Mercedes! Hashtag girl boss!""",5,46,Story,https://www.reddit.com/r/antiMLM/comments/qkk06g/i_was_told_to_post_this_short_story_here/
What is the biggest lie a MLM recruiter has told you?,"What is the biggest lie you have been told by a MLM recruiter, it could be a lie about the product or a lie about how much they make etc....",96,71,Story,https://www.reddit.com/r/antiMLM/comments/qkjcm7/what_is_the_biggest_lie_a_mlm_recruiter_has_told/
Designer Lifestyle Now??,"**Editing to add I’ve looked through the pinned post and couldn’t find anything so sorry if it’s there!!**

For context I’m chronically ill and finally well enough to look for work but it’s has to be 100% from home. A jobsearch site brought up a “Sales Consultant” position with a company called Designer Lifestyle Now. On the surface I can’t find any blatant signs of MLM, and I’m usually the first to recognise one. It’s no cold calling/messaging, no product selling, I’m not even sure exactly *what* they do to be honest. They have a full story on their website about having gone through MLMs and hating it (without naming any but it’s clearly things like amway and young living) so that’s interesting? I’m not going to apply purely because it’s not sitting right with me despite no evidence beyond how vague they are and having just arrived in Aus apparently, but I’m still curious about whether anyone knows of them and whether they are actually an MLM. Thanks!",2,7,Discussion,https://www.reddit.com/r/antiMLM/comments/qir7j3/designer_lifestyle_now/
Ziprecruiter almost got me into an MLM,"I've been out of work for a month and I've applied to so many different jobs that I constantly get phone calls and emails about interviews. Yesterday I received a call asking me to come into an interview  for a "" Sales Postion"". Keep in mind when I was eighteen I once fell for a ""Communications Sales"" postion only for it to be an MLM that was selling horrible internet from AT&T and DirecTV packages in a Sam's Club with a unrealistic daily qutoa and almost nonexistent pay. Luckily I was horrible on the first day and they told me to call in a few days if I wanted to come back but I called and said I was no longer interested and they never contacted me again  or paid me for time. After that I had thought I learned my lesson and avoided similar schemes once I realized what they really were.  Now fast forward to  a few days ago,  I was on Ziprecruiter when I was scrolling and accidentally clicked a stupid one touch apply for a ""Sales Position"" but I've only been contacted once from a Ziprecruiter posting so didn't think anything of it. I got a call Yesterday Morning and when I answered it was interesting. 

Hun: Hi, this is ( Guy with an extremely thick accent) from ( I couldn't understand what The ""Businesses"" name was because his accent was thicker than molasses) is this ( My name but with an awful pronunciation of it) .

Me: Yes, this is him

Hun: Great, would you like to come in for an interview we have many open ""Sales Positions"" and we work with many different clients in many different fields.

Me: OK but what does the postion pay and entail? Also what exactly do you do?

Hun: We'll discuss that at the interview. We have many open ""Sales Positions"" and we work with many different clients in many different fields.

Me: You're not answering any of my questions can I speak to someone else who can give me more information. 

Hun: Yes I'm answering your questions, we have many open ""Sales Positions"" and we work with many different clients in many different fields.

Pissed Off Me: Let me guess this is one of those MLM'S where I'll be standing in a Costco  begging people to buy something they don't want buy.

Hun: Yes we do work in Costco for our Clients....

Me:  F-You, Don't ever call this number again. 

I then blocked the number and I know should have just hung up once I couldn't get a straight answer  but I just wanted to see how far I could get and if I could get them to admit it. On the bright side I got a legit job offer and took it later that day and  I start Monday.",20,50,Story,https://www.reddit.com/r/antiMLM/comments/qilam4/ziprecruiter_almost_got_me_into_an_mlm/
MLM deterrent.,"My friend got like 3 people trying to get him to join their MLM and one day he came in one of these and one of them spent like 10min defending themselves.

  
[https://bogbros.com/collections/anti-pyramids/products/pyramid-scheme-no-shirt](https://bogbros.com/collections/anti-pyramids/products/pyramid-scheme-no-shirt)",4,23,Story,https://www.reddit.com/r/antiMLM/comments/qi48gr/mlm_deterrent/
Virtual Shopping Event aka MLM gathering,"Got invited to a virtual shopping event on Facebook. Within minutes I realized it was just a gathering ground for various MLMs....so I kindly posted in the group that MLMs were dangerous and predatory (with a bunch of links about the various MLMs featured) and how maybe some people should think twice about their personal ""businesses."" I was invited by an old acquaintance who recently joined Seint so it was especially sad to see so many people promoting pyramid schemes.

After I posted, I was blocked from the group so I reached out to the admin about why (her response is the last photo), I played the game and she let me back in. Couldn't do anything more than that because all of the huns were adamant that this business was great for them (one even made an entire post about how she didnt have any team members and needed some ASAP)

I've posted the pictures of the vendors along with their cash ""prize"" and the message from the admin.

https://preview.redd.it/c7gxjs0f7aw71.jpg?width=1125&format=pjpg&auto=webp&s=091d96102eacd3da0ee8f5e7a35f220826e2afb0

https://preview.redd.it/ewqzqrfg7aw71.jpg?width=1125&format=pjpg&auto=webp&s=c24729e0873c1ce45fee7fd387b172fe808157ca

https://preview.redd.it/vwc0vhrh7aw71.jpg?width=940&format=pjpg&auto=webp&s=5af031862cb801c9948d2ae1ba358eb9c4cf5493

https://preview.redd.it/2asrhfui7aw71.jpg?width=1125&format=pjpg&auto=webp&s=7e37354685e2cfc0a4dfd7e8a8e61743c50b2580

&#x200B;",10,14,Story,https://www.reddit.com/r/antiMLM/comments/qi0110/virtual_shopping_event_aka_mlm_gathering/
"Not sure if- ope, I was right.",,4,38,Story,https://www.reddit.com/gallery/qh2iqx
"One of my friends got sucked into an MLM, how do I help him get out before it's too late?","Long story short, one of my good friends from high school got into this MLM purely because of one of his old friends from high school got in with the company and all their ""training"" program they like to call it which in reality is just suckering your friends into joining the company. Which honestly speaking, I can't help but feel disrespected/used. To try to con me into something that will not only fuck me over but alienate me from my friends and family. I am not so easily manipulated, but some of the mind games, psychological tricks, how they try to corner you into making a decision that benefits them, say everything you wanna hear, really got my alarm bells blaring figuratively speaking, like my intuition was acting up. Glad I knew subconsciously something was not right or I would have fallen for their schemes. 

/vent.",4,11,World Financial Group,https://www.reddit.com/r/antiMLM/comments/qh27no/one_of_my_friends_got_sucked_into_an_mlm_how_do_i/
