TITLE,TEXT,REPLIES,SCORE,FLAIR,URL
These huns are getting sneaky..,"Short story. I'm scrolling TikTok. Come across one of a boudoir-looking model who says she wants to take on another 3 girls for her ""brand"". She says ""18+ only, must be comfortable with taking boudoir photos, must take your own photos & I'll edit them"" (she's also a photographer). 

She says she'd promote on her page with almost 350K followers & once *your* account reaches 10K, you'll promote yourself & basically make the money from monetization/ads etc. 

Soooo I sent in some if my old boudoir photos cause hey, why not, could be a lil extra beer money a month & they're tasteful/fun to do. Wellllll . . . .

It's Herbalife. It's frickin Herbalife. She responded ""you're beautiful! Love it! So here's how it works: I help you build your page to 10K then when you post your photos, you say stuff about how these *awesome* products give you confidence & help you lose weight blah blah blah, buy the starter kit & after the first month, try & get more folks that you ""promote"" and blah blah blah""

Waste. Of. My. Damn. Time.",37,402,Story,https://www.reddit.com/r/antiMLM/comments/qwqzsx/these_huns_are_getting_sneaky/
"Girl I went to school with got brainwashed into joining the cult, she posted this on her Instagram story today and I don't have to say any more, pic say it all.",,26,81,JuicePlus,https://i.redd.it/vt6m8zifl6081.png
Leaving WFG after giving them my hard earned $400. Is there any way that my bank (scotiabank) can help me?,"Good day!

I’m new on this sub and currently living in Canada for almost a year and a half now.

To start, I am an international student from the Philippines and I am currently on work permit working at a fast food restaurant as a supervisor, so basically my salary is enough for me to survive for the next paycheck plus I do save like around $100-$200 every cutoff which I strictly put to my savings account for rainy days and for my PR application fees for the future. I also have a second job as a inventory associate for retail stores to get more hours.

So this started when my cousin who is here in Canada for almost 6-7 years now asked if we can set up a zoom meeting because she told me that she will teach me how to file my taxes (in which she did not). So on that meeting, she first introduced World Finance Group (WFG) and their history blabla how their business works and their products/services etc. Then after that, she told me that the reason why most people want to own a business here in Canada is to have their taxes written off which as an agent you can get your taxes written off for acquiring a business code. So I said yeah sure I am down to get my taxes written off but she told me that I need to pay $150 before taxes for me to earn a business code which I payed. 

After paying, I did some research about WFG where I read a lot of bad reviews and that I can commit tax fraud if I continue so for our second meeting she told me that I need to purchase an online course which is around $200 (Oliver’s Learning LLQP Pre-licensing Bundle) for me to be licensed so that I can use my business code legally, in which she didn’t mention in the first place. So around that time I just agreed to pay the $200 so that no money would be wasted (In which I was wrong. I should’ve just let that $150 away)

But since I am working two jobs, my second job promoted me as a supervisor so basically I am working 2 supervisory position which is stressful but I don’t mind as long as it is honest money. But now I don’t have time to do the courses and I heard that there is a lot of hidden charges ahead if I continue with WFG. 

I honestly regret the day that I was introduced with them. It’s not a lot of money but that $400 means a lot to me because I am trying to save so hard for rainy days that I can’t even repair or replace my glasses since it is expensive here and it’s been two years already. I can’t even buy a new non-slip shoes for my work but all I know is that $400 is now a lesson but I’m still trying my luck.

Tldr: Was introduced to WFG about writing my taxes off that continued to purchasing their online courses and now I want out. Can my bank issuer help me?

Btw sorry for my english guys. It’s not my native tongue",7,12,Help/Advice,https://www.reddit.com/r/antiMLM/comments/qvhp17/leaving_wfg_after_giving_them_my_hard_earned_400/
Anyone ever get scammed by people from Ambit energy?,"At first I felt so guilty for cutting off my former best “friend” after he scammed me out of 100 dollars when I tried to become a rep, doing literally everything he did, and not one person wanted to be a customer. So this guy took total advantage of me. And I bet his wife had a hand in guilting his family into becoming his customers too. 

But everyone I know agrees I did the right thing. The fact that he passive aggressively referred to me as his FORMER best friend, even in an Ambit group on Facebook, says all I need to know about him as well! I was already trying to fix things between us and I was more than willing to (had distanced myself for other reasons) but then that happened. Even tricking me into “meeting up” ……… at a seminar. 

Anyone else got scammed by people at Ambit? He also did the “it’s NOT a pyramid scheme!! 😄” bs.",0,12,Story,https://www.reddit.com/r/antiMLM/comments/qvg4z1/anyone_ever_get_scammed_by_people_from_ambit/
Kirby Vacuum Salesman Lies About Needing a Place to Stay and Gives the Worst Sales Pitch," 

To keep it brief: I’m a college student living in Norfolk, Virginia with 2 other friends who're college students. The neighborhood I’m in is pretty rough and Norfolk itself is a pretty rough city, but I like to help out people whenever I can. Am I naïve? Maybe. I just like to aid whoever needs help.

A 6'5""-6'6"" (general estimate, for reference I'm 6'1 and he was towering above me) Kirby Vacuum Salesman comes up to the front door asking if he could stay here until his brother picked him up to go back home to North Carolina. He said it’d be short and seeing as I didn’t want him in harms way, I took him in, even though my gut had me feeling otherwise. He asked me my name and I, unconsciously, gave him my first name. He asked if I was Muslim and I replied ""no it's a Hindi name"" and he goes ""Muslim, Hinduism, same shit"". I just replied with ""no not really"" but let him in anyways because he seemed alright enough.

We sat on the living room couch and he was asking about if we could play Call of Duty on my PS4 and I was like ""I don't really have PS plus, I just use the PS4 for watching stuff"". I asked him questions like 'how long are you going to be waiting', 'what do you do' etc and the guy goes ""so because I'm a man with dreads, you think I'm gonna rob you? Why are you asking all these questions man?"". I have really bad anxiety, especially with letting strangers into my house. Why did I do this? Idk I wanted to be a good Samaritan but the guy seemed shadier and shadier with the more he talked. So I replied with the truth. ""I just got anxiety man"" and he goes ""Me too. I was waiting for 2 hours before knocking on your door"". I nodded but I was looking around just because I felt like a panic attack was coming up.

I actually told him of a non-existent friend that would be willing to let him crash for a night and he said ""Nah man I just need a ride"". I also offered to pay for an Uber/Lyft since I originally assumed he lived in Norfolk or Hampton Roads in general, but the guy goes ""No man I need to go to North Carolina"" so that idea quickly died.

He switched topics and talked about how he had college hoes (despite him being 41) and he was talking about how they like to clean. He pointed at the hallway and was like ""See? You like to clean right?"" I was like 'uh yeah, sure'. He talks about some metaphor about borrowing my hypothetical car and asking if I let him borrowed it, would it be my fault if he crashed it. I originally said ""it'd be your fault"" and he was like ""No man! It'd be your fault because you let me borrow it!"". Afterwards, he talked about doing something right for me by ""repaying"" me and that I should give him my social security number, phone number, address, and first and last name.

I was very fucking confused. I got a pen and some paper and wrote a fake name, fake phone number, and I was gonna write a fake social security number but then I decided against it. His partner arrived and we both left the building. His partner parked behind the building but he got upset for some reason even though it was legit a minute walk. Then his partner randomly drove off and the Salesman got annoyed.

The guy kept asking me if I had a social security number and I bullshitted and said ""Actually I'm a student migrant on a visa"" despite being a US citizen. He got upset and was like ""so do you have numbers on it?"" and I just bullshitted and said ""Idk the numbers, I don't have my visa with me it's with my parents"" and he got annoyed. He kept pushing me to give him something and I kept telling him ""I don't have a social security number or a green card man, I'm just a foreign student"".

We went back to the apt door and my 2 roommates opened it. He sat down on the couch and gave one of the worst sales pitches ever.

He complimented everybody by calling us ""smart college kids"" and then talked about an ""opportunity"" for us: paying 25 cents a day for a fucking Kirby vacuum. He told us how we could get a vacuum to clean up our apt and one of my roommates was like ""but we don't own this building. We just rent it and we don't really care about it"". The guy was annoyed and kept pushing it on us and we all just said ""nah"". He got angry and said ""so y'all can't spend 25 cents a day?"" and we all just said we have utilities, rent, and groceries to pay. His partner eventually found our apartment and he was pretty alright, he popped in for like 30 seconds and was an older guy like around his mid to late 50s, asking the other guy if he's gonna get in the ride or not. After offering us the vacuum again, we all said no and he left.

My roommates and I laughed it off since I invited a literal vacuum salesman into our home, but it was definitely stressful for me. Like yeah it was just a salesman and it was my own fault for letting a complete stranger into my home, but Jesus my anxiety was riding really high once he started asking for my personal info out of nowhere. He vaguely talked about his college hoes cleaning and then all of a sudden talks about ""repaying"" me. I have too big of a heart, but not big enough to just give somebody personal information for no reason. Overall, the guy stayed in our apartment for about an hour and 15 minutes but Jesus fuck it was stressful being with him alone before my roommates came in.

TL;DR I messed up by inviting a salesman (who could've been anybody else) into my home to wait for a ride and he gave the most awkward sales pitch ever. Shoutout to my racial ambiguity for saving the day",5,13,Story,https://www.reddit.com/r/antiMLM/comments/quzryp/kirby_vacuum_salesman_lies_about_needing_a_place/
As soon as she said her job was about “Health & Wellness” I knew where things were headed. Second Date Update : Danielle and Lee (Free Coffee Scam Girl) | Brooke & Jeffrey In The Morning,,1,6,Story,https://www.brookeandjeffrey.com/content/2021-11-01-second-date-danielle-and-lee-free-coffee-scam-girl/
A friend almost convinced me with Amway/URA,"Ok, this was was a tough one. So, first of all, I received a text from a friend of mine saying how I would benefit from a mentor. I was intrigued by it, said yes, and met this so-called mentor first thing he ask me how do I envision my life for eight years how do I want to live. I told him my dream lifestyle blah blah then he tried to schedule another meeting fine I proceeded with that meeting and got invited to be exposed to other mentees in that meeting. They finally talked about Amway and URA. I was highly skeptical, so I went ahead and started to do some research and found nothing but negativity regarding this MLM and what they did to me. They do it to everyone else; at that moment, I knew I wanted out but stayed a little longer to find out more information. Here comes the next meeting where the ""mentor"" tells me the exact details it costs $180 to start, then $50 a month to heat motivational crap that's useless, then four annual meetings which you must attend pay for food, hotel, etc. and they want you to have at least % three return which is about $300 a month. At that point, I was like, ok, I am running as far as I can from this. I messaged them, making up a story of how my mom is in the hospital, and I can't focus on this now. To my surprise, they attacked me deemed me unworthy, and I did not pass their trial phase; the funniest part for me is that I told them I did not want to be a part of this in the text, but they managed to flip the script and say it's my fault hahahahhaha so funny. Everyone be safe from these BS scams out there URA/Amway complete BS

https://preview.redd.it/h22t51crwtz71.png?width=1154&format=png&auto=webp&s=0a9d4fb6770956eb09ace076e3ac1c2205658434

https://preview.redd.it/ffgwv0crwtz71.png?width=1124&format=png&auto=webp&s=b317333c5e647c5ccdef78e6d3b994ac6c0dd4b8",13,31,Story,https://www.reddit.com/r/antiMLM/comments/qur5x7/a_friend_almost_convinced_me_with_amwayura/
FOREVER LIVING ANNUAL BONUS EVENT IN INDIA,"Forever Living India has disguised itself as two different societies in India-  
1. Waf Entrepreneurs  
2. Achievers Club  
These two societies target college going students and show them their fake lifestyle to influence them to be a part of this society and earn this much..   
Even during lockdown they had online meetings to increase their downlines as people were looking for work from home opportunities.  
Shame on them!  


https://preview.redd.it/m6ixm5qnkpz71.png?width=603&format=png&auto=webp&s=024f33360c8aa0b117bac2484a6b795ee26eb857",0,17,Story,https://www.reddit.com/r/antiMLM/comments/quakbc/forever_living_annual_bonus_event_in_india/
ISO Vector/Cutco stories from Vancouver BC,"I'm looking for anyone in or near Metro Vancouver willing to share their Vector experience w/ me. I'm working on a story for my college newspaper (about mlms on college campuses) and need a local angle. 

Vector preferred but honestly, I'll take any Vancouver mlm story you got. 

TIA.",2,10,Vector,https://www.reddit.com/r/antiMLM/comments/qu01k4/iso_vectorcutco_stories_from_vancouver_bc/
Disappointed but not at all surprised…,"My daughter is 2 and just started daycare at a Christian school that I went to when I was younger. I went to Christian private schools until college but am not religious at all now. I choose to send my daughter to this school because it’s A-rated and insanely inexpensive, so I am willing to overlook the religion aspect.

I took my daughter to a fall event today the school put on and when we walked by the tables of vendors, EVERY SINGLE TABLE was an MLM. I sort of anticipated this being the case but was so disappointed that the school would allow these predatory companies to sell there.",11,76,Story,https://www.reddit.com/r/antiMLM/comments/qtf2oy/disappointed_but_not_at_all_surprised/
Life Coach MLM??,,11,17,Story,https://www.reddit.com/gallery/qtdkfz
"Is ""LifeWave"" an MLM?","My aunt has called my mom a few times asking my mom to buy these patches of some sort. My aunt has been part of various MLMs for the past 30 years. She has spend those thirty years asking for money and trying to shill to my mom along with other family members. In fact she has spent the entire inheritance of me and my brother on these MLMs (that's a story for another day). And with this new ""company"" she's promoting, I'm wondering if this is an MLM. I googled the name of the company and I got websites claiming it isn't an MLM and some that claim it's an MLM. What do you guys think? Do any of you have any experience with this company? And it this an MLM?",3,18,Help/Advice,https://www.reddit.com/r/antiMLM/comments/qt3tgm/is_lifewave_an_mlm/
Praying on people in need,"Hi huns!

I joined to have a laugh sometimes, because MLMs make no sense. 

Brace yourselves: This story is detailed, but it's exactly how I felt talking to the Hun.

In april 2018 I finally left my abusive boss. I was  a student, still making my study plans, and wandering if it was smart to study drama as a free choice subject. I met a drama student in other circumstances, and I wanted to get coffee with her and discuss about the subject. I foolishly mentioned what went wrong with my boss...

""I'm so sorry! I really have something for you"". I was guilt-tripped AF, even if my parents reassured me, I wanted to find a job quickly. I rolled my eyes at the privilege when she chose one of the most expensive cafés to get coffee. ""I have a great opportunity for you! You can work from home, you just have to recruit and market on SoMe, it's wonderful for students"" ""Oh, a private company. Do you guys need my CV? What kind of competence are you looking for?"". \*stupid me\*

""Oh, it's just a small buisness. We are into direct sales"". It sounded so interesting. A small buisness, I like small buisnesses. I like working environments where you are rather delivering a quality product than getting high on competition or workaholism while you sell low quality crap. She started talking about ""direct sails"", and ""You know, those shady pyramid schemes are illegal and unfair because the boss gets all the money and bla bla bla"". So far, so good. I couldn't but agree. Why working for somebody that takes all the profit for themselves while other people work hard for nothing? Why having a complicated sails system? Right? Even if I've never felt like a pushy promoter, I was interested. ""So, where is this small buisness in the city? Can I go and meet the manager?"". Yup. Since she described it as a small buisness, I imagined a shop that also has something going on on the net, and since she didn't mention the product, I wanted to see the shop and have a second opinion on what kind of salesperson and recruiter they were looking for. Just to make sure I was competent enough for them. 

""Yeah, there is a selling point here, but we work online. If you subscribe and pay me so and so, I will get you recruited and you will work from home. You decide the hours, you will make money! The more people you get involved, the more ...."". OK. Now it sounds more complicated. And, why should I pay her to work? Why so much? 

""Mmmh... I'm currently struggling a little bit with money. Not sure if I can help. I need to think about it"" ""OK, but please join, you will make a lot of money, it's a great opportunity, working on Social Media...."". My interest in the thing went imediately downhill. Not worth the trouble, of course.

Next time we met: ""Have you made up your mind?"" ""Mmmh... I confess I'm not sure. I like to work in small environments. Face to face with people. That buisness... I don't know"" ""You can buy a so and so package and sign up to the course. It's in the luxury hotel, a guy will be there and explain it all. You will be sooooo motivated to sell and recruit. Buy so and so...."". Seriously, why should an unemployed person pay to get trained after recruiting? And why can't I meet anybody else from the company? And why is it so difficult to know WTF are we selling? Jeez! Are we selling mops? Are we selling nappies? Are we selling Unicorns? Say *something*! 

""Now it's just me and my friend selling beauty products, but if you join..."" ""OK. You said *direct sales*. Who is *making* the beauty products? Does your friend have a lab? Do you need help with making?"" ""No, we only sell online"" ""So, this is not direct sales. It's just sales"" -when being a basic bitch like me is actually a weapon-

Hun starts drawing a scheme again: ""You see, this sells to this, that recruits this, that sells to this..."" ""Exactly what I was talking about. Sell, resell, resell... it's so complicated, it is not a small buisness. It's as unfair and domplicated as it can be. I can find a job at a big supermarket chain, if I must"". She went pale. ""No, if you buy this package from my friend Thingey and go to the luxury hotell this weekend"" ""Thanks. Sorry, I really have to go"".

When even an unexperienced student thinks that paying to get a job is bullshit. And for the people who pray on widows, MeToo girls like me, immigrants like me, scam the young, scam the elderly, scam the sick and the needy... y'all know what kind of thougts I am cansoring, so I don't need to write them down here.",8,52,Story,https://www.reddit.com/r/antiMLM/comments/qsho8h/praying_on_people_in_need/
"Isn’t it exhausting to constantly feign excitement over every single recipe and testimonial, even recipes that OP posts but says she hasn’t tried yet?! OP=purple; Upline Hun=green; Hype Hun=yellow (follow to the end to see her coming in hot with the defense!)",,8,33,Story,https://www.reddit.com/gallery/qs5qkr
"PLEASE HELP, major major MLM that involves taking money from CHARITIES","So I currently work for a “marketing agency” berth cult like culture with promises of making millions if you just make it from a “Client Associate” to a “Director of Operations” in one year. So they call it marketing but all you do if beg money in front of a store. They pose as super friendly and happy but all the people are overworked, underpaid and their safety is compromised. On TOP of that the company keeps a huge chunk of proceeds from the donations. Worst part they make themselves untraceable, have 17 offices with 17 different names. Here are some other stories from people who work for the same disastrous pyramid: 
[story 1](https://www.reddit.com/r/Austin/comments/fi3l00/texas_events_and_management/?utm_source=share&utm_medium=ios_app&utm_name=iossmf) 
[story 2](https://www.reddit.com/r/denverjobs/comments/lihnxq/a_warning_to_recent_college_grads_seeking_work/?utm_source=share&utm_medium=ios_app&utm_name=iossmf)
[story 3](https://www.ripoffreport.com/report/dynamic-connections/denver-colorado-imi-sfts-line-1497948)
[story 4](https://www.reddit.com/r/Denver/comments/ec5bw1/imi_denver_supposed_marketing_firm_a_warning_to/?utm_source=share&utm_medium=ios_app&utm_name=iossmf)
[story 5](https://www.reddit.com/r/Denver/comments/ldf2x7/dci_collective/?utm_source=share&utm_medium=ios_app&utm_name=iossmf)",6,18,Story,https://www.reddit.com/r/antiMLM/comments/qs2mqk/please_help_major_major_mlm_that_involves_taking/
Inclusiveness within MLM?,"I don’t know why I’m posting this but I’m bothered by the lack of racial and religious inclusivity among MLMs that I have seen. 

Backstory: I am a full-time married mother of two little boys and I follow this chick on Instagram who presents herself as real and relatable mom. I won’t identify her because she seems like a nice person. She posts a lot of funny mommy Instagram reels. She does Beachbody and I considered joining because I’m really into health, wellness and fitness. I thought it would be cool to be around other moms who are into health and fitness. I do struggle with loneliness and, outside of my husband, have zero support for my healthy lifestyle. Then she posts that she’s looking for other like-minded moms who share her “faith and values” (aka Christian). And then I noticed all the moms in the groups are White and Christian women. No way am I, a Middle Eastern woman, joining this shit. I would feel completely excluded.

My question is…it’s 2021, are all these MLMs like this? Because I haven’t seen any non-Christian women of color in any of these Beachbody groups. 

Also- I have nothing against white Christian women.",65,97,Beach Body,https://www.reddit.com/r/antiMLM/comments/qr8q3g/inclusiveness_within_mlm/
MLMs are poison to real connection and friendship,"I was genuinely thrilled when my old friend from middle and high school reached out to me on Facebook. I had nothing but happy memories of our time together in Jewish Folk Dance classes, drama club, sleep-overs, and galavanting around on her family’s farm.  We grew up and went to college and got married and lost touch. I genuinely wanted to reconnect and rekindle our friendship. But all she said to me was “I’m selling this product and thought of you!” (I don’t even remember what MLM it was—one of the supplement ones). I said something polite and noncommittal but didn’t purchase. I tried to catch up with her, but since I didn’t buy anything, she wouldn’t talk to me anymore. It crushed me. MLMs are poison to real, genuine connection and friendship.",30,408,Story,https://www.reddit.com/r/antiMLM/comments/qr4u32/mlms_are_poison_to_real_connection_and_friendship/
Waiting to see how long before she folds. (Please read all the captions for the fuller story.),,31,43,Story,https://www.reddit.com/gallery/qqcdme
